{
  "$schema": "http://json-schema.org/draft-07/schema#",
  "name": "nsip-api-client",
  "version": "1.1.2",
  "description": "NSIP sheep breeding data access via MCP server for Claude Code",
  "owner": "epicpast",
  "plugins": [
    {
      "name": "nsip-api-client",
      "description": "Access NSIP sheep breeding data with MCP tools and slash commands for discovering breeds, looking up animals, viewing lineages and progeny, and monitoring server health",
      "version": "1.1.2",
      "author": "epicpast",
      "source": ".",
      "category": "data-access"
    }
  ]
}
